<Project xmlns:xsi="http://www.w3.org/2001/XMLSchema-instance" xsi:schemaLocation="http://www.w3.org/2001/XMLSchema https://raw.githubusercontent.com/DArkHekRoMaNT/VSMods/master/Mod.xsd">
	<PropertyGroup>
		<Name>Player Corpse</Name>
		<ModId>playercorpse</ModId>
		<Version>1.11.1</Version>
		<Authors>DArkHekRoMaNT</Authors>
		<MinimalGameVersion>1.20.0</MinimalGameVersion>
		<GameVersion>1.20.7</GameVersion>
		<Website>https://github.com/darkhekromant/PlayerCorpse</Website>
	</PropertyGroup>
	<ItemGroup>
		<Dependencies Include="commonlib">
			<Version>2.6.1</Version>
		</Dependencies>

		<IncludeFiles Include="modicon.png" />
		<IncludeFiles Include="LICENSE" />
		<IncludeFiles Include="README.md" />
	</ItemGroup>
</Project>
